{
  "customerCode": "HRB-WY",
  "customerName": "哈尔滨市第五医院",
  "billingEnabled": true,
  "billingPricingMode": "hybrid",
  "productRules": [
    {
      "ruleType": "FIXED_PRICE",
      "name": "市五院上肢止血带15",
      "priority": 10,
      "keywords": [
        "上肢止血带"
      ],
      "price": 15.0,
      "skipPackaging": true,
      "skipDiscount": true,
      "isActive": true,
      "matchMode": "first",
      "keywordMatchMode": "contains",
      "acceptedTypes": [
        "敷料包（无纺布）"
      ]
    },
    {
      "ruleType": "FIXED_PRICE",
      "name": "市五院下肢止血带15",
      "priority": 10,
      "keywords": [
        "下肢止血带"
      ],
      "price": 15.0,
      "skipPackaging": true,
      "skipDiscount": true,
      "isActive": true,
      "matchMode": "first",
      "keywordMatchMode": "contains",
      "acceptedTypes": [
        "敷料包（无纺布）"
      ]
    },
    {
      "ruleType": "FIXED_PRICE",
      "name": "市五院妇产科布袋15",
      "priority": 10,
      "keywords": [
        "妇产科布袋"
      ],
      "price": 15.0,
      "skipPackaging": true,
      "skipDiscount": true,
      "isActive": true,
      "matchMode": "first",
      "keywordMatchMode": "contains",
      "acceptedTypes": [
        "敷料包（无纺布）"
      ]
    },
    {
      "ruleType": "FIXED_PRICE",
      "name": "市五院妇产科纱条15",
      "priority": 10,
      "keywords": [
        "妇产科纱条"
      ],
      "price": 15.0,
      "skipPackaging": true,
      "skipDiscount": true,
      "isActive": true,
      "matchMode": "first",
      "keywordMatchMode": "contains",
      "acceptedTypes": [
        "敷料包（无纺布）"
      ]
    },
    {
      "ruleType": "FIXED_PRICE",
      "name": "市五院小布袋15",
      "priority": 10,
      "keywords": [
        "小布袋"
      ],
      "price": 15.0,
      "skipPackaging": true,
      "skipDiscount": true,
      "isActive": true,
      "matchMode": "first",
      "keywordMatchMode": "contains",
      "acceptedTypes": [
        "敷料包（无纺布）"
      ]
    },
    {
      "ruleType": "FIXED_PRICE",
      "name": "市五院手套2.5",
      "priority": 10,
      "keywords": [
        "手套"
      ],
      "price": 2.5,
      "skipPackaging": true,
      "skipDiscount": true,
      "isActive": true,
      "matchMode": "first",
      "keywordMatchMode": "contains",
      "acceptedTypes": [
        "敷料包（无纺布）"
      ]
    },
    {
      "ruleType": "FIXED_PRICE",
      "name": "市五院纱布15",
      "priority": 10,
      "keywords": [
        "纱布"
      ],
      "price": 15.0,
      "skipPackaging": true,
      "skipDiscount": true,
      "isActive": true,
      "matchMode": "first",
      "keywordMatchMode": "contains",
      "acceptedTypes": [
        "敷料包（无纺布）"
      ]
    },
    {
      "ruleType": "FIXED_PRICE",
      "name": "市五院驱血带4",
      "priority": 10,
      "keywords": [
        "驱血带"
      ],
      "price": 4.0,
      "skipPackaging": true,
      "skipDiscount": true,
      "isActive": true,
      "matchMode": "first",
      "keywordMatchMode": "contains",
      "acceptedTypes": [
        "敷料包（无纺布）"
      ]
    }
  ]
}
