{
  "customerCode": "HRB-HIT",
  "customerName": "哈尔滨工业大学医院",
  "billingEnabled": true,
  "billingPricingMode": "hybrid",
  "productRules": [
    {
      "ruleType": "FOLD",
      "name": "哈工大针架5合1加架含包材",
      "priority": 10,
      "keywords": [
        "针架1针@contains"
      ],
      "threshold": 5,
      "foldRatio": 5,
      "extraCount": 1,
      "maxInstrumentCount": 6,
      "price": 5.5,
      "skipPackaging": false,
      "skipDiscount": true,
      "isActive": true,
      "matchMode": "first",
      "acceptedTypes": [
        "额外包（纸塑袋）"
      ]
    },
    {
      "ruleType": "FOLD",
      "name": "哈工大针架5合1加架免包材",
      "priority": 11,
      "keywords": [
        "针架1针@contains"
      ],
      "threshold": 5,
      "foldRatio": 5,
      "extraCount": 1,
      "minInstrumentCount": 7,
      "price": 5.5,
      "skipPackaging": true,
      "skipDiscount": true,
      "isActive": true,
      "matchMode": "first",
      "acceptedTypes": [
        "额外包（纸塑袋）"
      ]
    },
    {
      "ruleType": "FIXED_PRICE",
      "name": "哈工大克氏针48钢丝固定77",
      "priority": 12,
      "price": 77.0,
      "keywords": [
        "克氏针48钢丝4/W6050"
      ],
      "skipPackaging": true,
      "skipDiscount": true,
      "isActive": true,
      "matchMode": "first",
      "acceptedTypes": [
        "额外包（无纺布）"
      ]
    }
  ]
}
