{
  "customerCode": "YUANDONG-XN",
  "customerName": "黑龙江省远东心脑血管医院",
  "billingEnabled": true,
  "billingPricingMode": "hybrid",
  "productRules": [
    {
      "ruleType": "PRICE_PER_INSTRUMENT",
      "name": "远东双<3按件5.5加列出的袋",
      "priority": 10,
      "price": 5.5,
      "maxInstrumentCount": 2,
      "conditionsJson": "[{\"field\": \"bagAddon\", \"value\": \"all\"}]",
      "keywords": [
        "/双@contains",
        "/(双)@contains",
        "/（双）@contains"
      ],
      "skipPackaging": false,
      "skipDiscount": true,
      "isActive": true,
      "matchMode": "first",
      "keywordMatchMode": "contains",
      "acceptedTypes": [
        "额外包（纸塑袋）"
      ]
    },
    {
      "ruleType": "PRICE_PER_INSTRUMENT",
      "name": "远东双≥3按件5.5不加袋",
      "priority": 11,
      "price": 5.5,
      "minInstrumentCount": 3,
      "conditionsJson": "[{\"field\": \"bagAddon\", \"value\": \"none\"}]",
      "keywords": [
        "/双@contains",
        "/(双)@contains",
        "/（双）@contains"
      ],
      "skipPackaging": false,
      "skipDiscount": true,
      "isActive": true,
      "matchMode": "first",
      "keywordMatchMode": "contains",
      "acceptedTypes": [
        "额外包（纸塑袋）"
      ]
    }
  ]
}
